<?xml version="1.0" encoding="UTF-8"?>
<qtl:QueuedTaskList
  xmlns:qtl="urn:qtl:schema:v1"
  xmlns:xsi="http://www.w3.org/2001/XMLSchema-instance"
  xsi:schemaLocation="urn:qtl:schema:v1 qtl.xsd"
  version="1.0"
  description="AI Code Generation Error Remediation – Master Task Queue"
  createdAt="2026-05-27">

  <!-- ══════════════════════════════════════════════════════════
       TASK-001  Hallucinated APIs or Libraries
  ══════════════════════════════════════════════════════════ -->
  <qtl:Task id="TASK-001" queueIndex="1" status="QUEUED" createdAt="2026-05-27">
    <qtl:Title>Hallucinated APIs or Libraries</qtl:Title>
    <qtl:ErrorDescription>The model references functions, classes, packages, or APIs that do not exist.</qtl:ErrorDescription>
    <qtl:Category>API_CORRECTNESS</qtl:Category>
    <qtl:Priority>CRITICAL</qtl:Priority>
    <qtl:Symptoms>
      <qtl:Symptom id="1">Invented framework methods</qtl:Symptom>
      <qtl:Symptom id="2">Nonexistent SDK calls</qtl:Symptom>
      <qtl:Symptom id="3">Incorrect library namespaces</qtl:Symptom>
      <qtl:Symptom id="4">Fake command-line flags</qtl:Symptom>
    </qtl:Symptoms>
    <qtl:RemediationTasks>
      <qtl:RemediationTask id="1">Verify all APIs against official documentation</qtl:RemediationTask>
      <qtl:RemediationTask id="2">Build minimal compilation tests for every imported dependency</qtl:RemediationTask>
      <qtl:RemediationTask id="3">Create interface validation cards that instantiate referenced APIs</qtl:RemediationTask>
      <qtl:RemediationTask id="4">Enforce tool existence checks through a Restrictions Engine</qtl:RemediationTask>
      <qtl:RemediationTask id="5">Add schema-driven dependency manifests</qtl:RemediationTask>
      <qtl:RemediationTask id="6">Require compilation before continuation of implementation sips</qtl:RemediationTask>
    </qtl:RemediationTasks>
  </qtl:Task>

  <!-- ══════════════════════════════════════════════════════════
       TASK-002  Uncompilable Code
  ══════════════════════════════════════════════════════════ -->
  <qtl:Task id="TASK-002" queueIndex="2" status="QUEUED" createdAt="2026-05-27">
    <qtl:Title>Uncompilable Code</qtl:Title>
    <qtl:ErrorDescription>Generated code does not compile due to syntax errors, missing includes, invalid templates, or unresolved symbols.</qtl:ErrorDescription>
    <qtl:Category>BUILD_QUALITY</qtl:Category>
    <qtl:Priority>CRITICAL</qtl:Priority>
    <qtl:Symptoms>
      <qtl:Symptom id="1">Missing headers</qtl:Symptom>
      <qtl:Symptom id="2">Invalid generic syntax</qtl:Symptom>
      <qtl:Symptom id="3">Broken inheritance chains</qtl:Symptom>
      <qtl:Symptom id="4">Incorrect namespace usage</qtl:Symptom>
    </qtl:Symptoms>
    <qtl:RemediationTasks>
      <qtl:RemediationTask id="1">Introduce compile-only verification cards</qtl:RemediationTask>
      <qtl:RemediationTask id="2">Enforce one-sip compilation validation</qtl:RemediationTask>
      <qtl:RemediationTask id="3">Add static analysis stages</qtl:RemediationTask>
      <qtl:RemediationTask id="4">Create repository-wide build orchestration scripts</qtl:RemediationTask>
      <qtl:RemediationTask id="5">Require compiler output capture as numeric evidence</qtl:RemediationTask>
      <qtl:RemediationTask id="6">Add mandatory warning-level enforcement (-Wall -Wextra -Werror)</qtl:RemediationTask>
    </qtl:RemediationTasks>
  </qtl:Task>

  <!-- ══════════════════════════════════════════════════════════
       TASK-003  Placeholder Logic
  ══════════════════════════════════════════════════════════ -->
  <qtl:Task id="TASK-003" queueIndex="3" status="QUEUED" createdAt="2026-05-27">
    <qtl:Title>Placeholder Logic</qtl:Title>
    <qtl:ErrorDescription>The model inserts TODOs, stubs, fake implementations, or dummy return values.</qtl:ErrorDescription>
    <qtl:Category>CODE_COMPLETENESS</qtl:Category>
    <qtl:Priority>HIGH</qtl:Priority>
    <qtl:Symptoms>
      <qtl:Symptom id="1">return true;</qtl:Symptom>
      <qtl:Symptom id="2">return nullptr;</qtl:Symptom>
      <qtl:Symptom id="3">TODO comments</qtl:Symptom>
      <qtl:Symptom id="4">Mock behavior disguised as production logic</qtl:Symptom>
    </qtl:Symptoms>
    <qtl:RemediationTasks>
      <qtl:RemediationTask id="1">Add forbidden pattern restrictions</qtl:RemediationTask>
      <qtl:RemediationTask id="2">Scan repositories for TODO/FIXME markers</qtl:RemediationTask>
      <qtl:RemediationTask id="3">Require empirical outputs instead of placeholder returns</qtl:RemediationTask>
      <qtl:RemediationTask id="4">Reject incomplete execution paths</qtl:RemediationTask>
      <qtl:RemediationTask id="5">Enforce checkout evidence before marking work complete</qtl:RemediationTask>
    </qtl:RemediationTasks>
  </qtl:Task>

  <!-- ══════════════════════════════════════════════════════════
       TASK-004  Fabricated Completion Claims
  ══════════════════════════════════════════════════════════ -->
  <qtl:Task id="TASK-004" queueIndex="4" status="QUEUED" createdAt="2026-05-27">
    <qtl:Title>Fabricated Completion Claims</qtl:Title>
    <qtl:ErrorDescription>The model claims code was tested, compiled, benchmarked, or verified without execution evidence.</qtl:ErrorDescription>
    <qtl:Category>VERIFICATION</qtl:Category>
    <qtl:Priority>CRITICAL</qtl:Priority>
    <qtl:Symptoms>
      <qtl:Symptom id="1">"The system now works" without logs</qtl:Symptom>
      <qtl:Symptom id="2">"Tests passed" without output</qtl:Symptom>
      <qtl:Symptom id="3">"Benchmark successful" without metrics</qtl:Symptom>
      <qtl:Symptom id="4">Missing logs or outputs</qtl:Symptom>
    </qtl:Symptoms>
    <qtl:RemediationTasks>
      <qtl:RemediationTask id="1">Require execution logs for all claims</qtl:RemediationTask>
      <qtl:RemediationTask id="2">Store measurements in structured verification reports</qtl:RemediationTask>
      <qtl:RemediationTask id="3">Enforce numeric evidence outputs</qtl:RemediationTask>
      <qtl:RemediationTask id="4">Require exit_code observations</qtl:RemediationTask>
      <qtl:RemediationTask id="5">Capture benchmark metrics automatically</qtl:RemediationTask>
      <qtl:RemediationTask id="6">Add replayable execution scripts</qtl:RemediationTask>
    </qtl:RemediationTasks>
  </qtl:Task>

  <!-- ══════════════════════════════════════════════════════════
       TASK-005  Hardcoded Configuration
  ══════════════════════════════════════════════════════════ -->
  <qtl:Task id="TASK-005" queueIndex="5" status="QUEUED" createdAt="2026-05-27">
    <qtl:Title>Hardcoded Configuration</qtl:Title>
    <qtl:ErrorDescription>Runtime configuration is embedded directly into source code.</qtl:ErrorDescription>
    <qtl:Category>CONFIGURATION</qtl:Category>
    <qtl:Priority>HIGH</qtl:Priority>
    <qtl:Symptoms>
      <qtl:Symptom id="1">Embedded file paths</qtl:Symptom>
      <qtl:Symptom id="2">Fixed ports</qtl:Symptom>
      <qtl:Symptom id="3">Hardcoded credentials</qtl:Symptom>
      <qtl:Symptom id="4">Static runtime behavior</qtl:Symptom>
    </qtl:Symptoms>
    <qtl:RemediationTasks>
      <qtl:RemediationTask id="1">Externalize configuration into JSON/XML/YAML</qtl:RemediationTask>
      <qtl:RemediationTask id="2">Create schema validation layers</qtl:RemediationTask>
      <qtl:RemediationTask id="3">Implement runtime configuration loaders</qtl:RemediationTask>
      <qtl:RemediationTask id="4">Add configuration audit cards</qtl:RemediationTask>
      <qtl:RemediationTask id="5">Enforce separation of logic and configuration</qtl:RemediationTask>
      <qtl:RemediationTask id="6">Create environment-specific situation files</qtl:RemediationTask>
    </qtl:RemediationTasks>
  </qtl:Task>

  <!-- ══════════════════════════════════════════════════════════
       TASK-006  Monolithic Architecture
  ══════════════════════════════════════════════════════════ -->
  <qtl:Task id="TASK-006" queueIndex="6" status="QUEUED" createdAt="2026-05-27">
    <qtl:Title>Monolithic Architecture</qtl:Title>
    <qtl:ErrorDescription>Excessively large classes or functions with tightly coupled responsibilities.</qtl:ErrorDescription>
    <qtl:Category>ARCHITECTURE</qtl:Category>
    <qtl:Priority>HIGH</qtl:Priority>
    <qtl:Symptoms>
      <qtl:Symptom id="1">Giant switch statements</qtl:Symptom>
      <qtl:Symptom id="2">Massive controller classes</qtl:Symptom>
      <qtl:Symptom id="3">Rendering and logic mixed together</qtl:Symptom>
      <qtl:Symptom id="4">Shared mutable global state</qtl:Symptom>
    </qtl:Symptoms>
    <qtl:RemediationTasks>
      <qtl:RemediationTask id="1">Introduce package boundaries</qtl:RemediationTask>
      <qtl:RemediationTask id="2">Separate orchestration from execution</qtl:RemediationTask>
      <qtl:RemediationTask id="3">Split rendering from state management</qtl:RemediationTask>
      <qtl:RemediationTask id="4">Implement modular service layers</qtl:RemediationTask>
      <qtl:RemediationTask id="5">Add structural complexity restrictions</qtl:RemediationTask>
      <qtl:RemediationTask id="6">Enforce maximum file and function sizes</qtl:RemediationTask>
    </qtl:RemediationTasks>
  </qtl:Task>

  <!-- ══════════════════════════════════════════════════════════
       TASK-007  Duplicate Logic Generation
  ══════════════════════════════════════════════════════════ -->
  <qtl:Task id="TASK-007" queueIndex="7" status="QUEUED" createdAt="2026-05-27">
    <qtl:Title>Duplicate Logic Generation</qtl:Title>
    <qtl:ErrorDescription>Similar logic is regenerated repeatedly instead of abstracted.</qtl:ErrorDescription>
    <qtl:Category>ARCHITECTURE</qtl:Category>
    <qtl:Priority>MEDIUM</qtl:Priority>
    <qtl:Symptoms>
      <qtl:Symptom id="1">Repeated validation functions</qtl:Symptom>
      <qtl:Symptom id="2">Copy-pasted command handlers</qtl:Symptom>
      <qtl:Symptom id="3">Duplicated serialization logic</qtl:Symptom>
      <qtl:Symptom id="4">Multiple near-identical classes</qtl:Symptom>
    </qtl:Symptoms>